{
 "author": "kim-em",
 "body_blob": "af67bbd39031be5c6e56e9263711972d85f85d426af29bb37c964b431a45b609",
 "body_sha256": "af67bbd39031be5c6e56e9263711972d85f85d426af29bb37c964b431a45b609",
 "comment_id": 4652456072,
 "edited_at": "2026-06-08T19:19:02Z",
 "editor": "kim-em",
 "kind": "scoreboard",
 "node_id": "IC_kwDOSup8rs8AAAABFU7YiA",
 "pr": 70,
 "schema": "tauceti.scrape_event/v1"
}
