{
 "author": "kim-em",
 "body_blob": "5011827d6d874863e37f6fcb544b1388a812094277de9ea932e17be603018bb3",
 "body_sha256": "5011827d6d874863e37f6fcb544b1388a812094277de9ea932e17be603018bb3",
 "comment_id": 4620041515,
 "edited_at": "2026-06-04T10:24:13Z",
 "editor": "kim-em",
 "kind": "scoreboard",
 "node_id": "IC_kwDOSup8rs8AAAABE2A9Kw",
 "pr": 46,
 "schema": "tauceti.scrape_event/v1"
}
