{
 "author": "kim-em",
 "body_blob": "30dfee5d25ff5b73dfe4fd7b806b0980d32df2caf70f2094de93f075314eac2b",
 "body_sha256": "30dfee5d25ff5b73dfe4fd7b806b0980d32df2caf70f2094de93f075314eac2b",
 "comment_id": 3375464807,
 "edited_at": "2026-06-08T21:22:58Z",
 "editor": "kim-em",
 "kind": "thread",
 "node_id": "PRRC_kwDOSup8rs7JMYFn",
 "pr": 68,
 "schema": "tauceti.scrape_event/v1"
}
