{
 "author": "kim-em",
 "body_blob": "268e787527e9e53da2ef4ea57e409e702dabc8093495bf153472e30fa6aecd12",
 "body_sha256": "268e787527e9e53da2ef4ea57e409e702dabc8093495bf153472e30fa6aecd12",
 "comment_id": 4658037561,
 "edited_at": "2026-06-09T08:48:31Z",
 "editor": "kim-em",
 "kind": "scoreboard",
 "node_id": "IC_kwDOSup8rs8AAAABFaQDOQ",
 "pr": 85,
 "schema": "tauceti.scrape_event/v1"
}
