{
 "author": "kim-em",
 "body_blob": "c51e8c81cf399766b6f13ca27cc0849846842d153fdd03f69575a9733af74ff3",
 "body_sha256": "c51e8c81cf399766b6f13ca27cc0849846842d153fdd03f69575a9733af74ff3",
 "comment_id": 3381371001,
 "edited_at": "2026-06-09T15:26:59Z",
 "editor": "kim-em",
 "kind": "thread",
 "node_id": "PRRC_kwDOSup8rs7Ji6B5",
 "pr": 92,
 "schema": "tauceti.scrape_event/v1"
}
