{
 "author": "kim-em",
 "body_blob": "b5cc04fc790363c9dcde75bda587c35a2fd9d035d7bb7d2d5878b81da5370919",
 "body_sha256": "b5cc04fc790363c9dcde75bda587c35a2fd9d035d7bb7d2d5878b81da5370919",
 "comment_id": 3377002017,
 "edited_at": "2026-06-09T00:28:10Z",
 "editor": "kim-em",
 "kind": "thread",
 "node_id": "PRRC_kwDOSup8rs7JSPYh",
 "pr": 75,
 "schema": "tauceti.scrape_event/v1"
}
